{
  "$schema": "https://json-schema.org/draft/2020-12/schema",
  "$id": "https://qeva.org/protocol/qualification-0.1.schema.json",
  "title": "QEVA Qualification Assertion 0.1",
  "type": "object",
  "additionalProperties": false,
  "required": ["qualification_version", "id", "revision", "subject", "dimension", "outcome", "method", "artifact", "asserted_by", "asserted", "environment", "supersedes"],
  "properties": {
    "qualification_version": {"const": "0.1"},
    "id": {"type": "string", "pattern": "^qeva-qualification:1:[a-z0-9][a-z0-9._:-]*$"},
    "revision": {"type": "integer", "minimum": 1},
    "subject": {"type": "string", "pattern": "^qeva:1:[a-z0-9][a-z0-9._-]*@[1-9][0-9]*$"},
    "dimension": {"enum": ["editorial-review", "formal-derivation", "machine-replay", "computational-experiment", "empirical-replication", "refutation"]},
    "outcome": {"enum": ["pass", "fail", "inconclusive", "not-applicable"]},
    "method": {"type": "string", "minLength": 1},
    "artifact": {"type": ["string", "null"]},
    "asserted_by": {"type": "string", "minLength": 1},
    "asserted": {"type": "string", "pattern": "^[0-9]{4}-[0-9]{2}-[0-9]{2}$"},
    "environment": {"type": "object"},
    "supersedes": {"type": ["string", "null"], "pattern": "^qeva-qualification:1:[a-z0-9][a-z0-9._:-]*@[1-9][0-9]*$"}
  }
}
